{
  "observations": [
    {
      "bad_oracle": 0,
      "fixed_oracle": 0,
      "parameters": {
        "fault_enable": "disabled",
        "load_response_delay_cycles": 0
      },
      "point_id": "point:v1:fb32334d09626bbb885fa6ad8cfa7ef8356c7121e071bc13f43f2fe482a40d4b"
    },
    {
      "bad_oracle": 0,
      "fixed_oracle": 0,
      "parameters": {
        "fault_enable": "disabled",
        "load_response_delay_cycles": 1
      },
      "point_id": "point:v1:2869316dcbeea128848a1e7cd8ecafa29c621e4b6bc878cd476ca8ce4aa637b9"
    },
    {
      "bad_oracle": 0,
      "fixed_oracle": 0,
      "parameters": {
        "fault_enable": "guarded_bit0",
        "load_response_delay_cycles": 0
      },
      "point_id": "point:v1:39641e789b43093f764900a215a6061004c827afe48fe5249774d89889b29727"
    },
    {
      "bad_oracle": 1,
      "fixed_oracle": 0,
      "parameters": {
        "fault_enable": "guarded_bit0",
        "load_response_delay_cycles": 1
      },
      "point_id": "point:v1:95a1749bf79e8479e0cbac2c20ff2ecf3f6c5058b9b2cbe48087a034c1310e0c"
    }
  ],
  "schema_version": 1,
  "surface": "rtl_boundary_ground_truth",
  "sweep_space_sha256": "781a94cd68240a327a75139341938a0cb56c19e66c3e9ea6729fe484a5f89b22"
}
